<!-- edited with XML Spy v4.2 U (http://www.xmlspy.com) by Information Technology (Information Technology) -->
<!-- An example -->
<pnml xmlns:xsi="http://www.w3.org/2001/XMLSchema-instance" xsi:noNamespaceSchemaLocation="../xsd/Operonml_v-0-1.xsd">
	<!--
	***********************************************************************
	PETRINET STUFF
	***********************************************************************
	-->
	<net id="SampleNet" type="http://www.yasper.org/specs/epnml-1.1">
		<name>
			<text>SampleNet</text>
		</name>
		<description>
			<text/>
		</description>
		<toolspecific tool="Operon" version="1.0">
			<!-- Specifies which resource manager implementation to use
			 This is the only part that we are required to implement in order to user the framework.
			-->
			<resourceManagerInterface>com.hoodox.operon.example.ExampleResourceManager</resourceManagerInterface>
			<!-- 
			This is Optional, if we wish to put a time limit for this
			net to finish
			
			There are two types of timer execution
			1. explicit - the Scheduler will execute straight away once expired.
			2. implicit - the Scheduler will use one of the registered schedulers
			    and only execute at the next round trip. This can reduce memory since
			    there is only a finite number of jobs where as the explicit one will create
			    a job for every single case in memory.
			-->
			<implicitTimeToLive>
				<!-- add days - hours - mins - seconds -->
				<duration>10-0-0-0</duration>
				<!-- 
				Scheduler to use is active is triggerType is implicit.
				-->
				<schedulerToUse ref="Every5Mins"/>
			</implicitTimeToLive>
			<!--
			This is where we registered various types of Quartz Cron Triggers
			Different types of triggers have different time time interval.
			Every single Timed Transition will have a Scheduler id associated with it.
			The Scheduler will be used to Trigger the Enbaled Time Transition
			-->
			<schedulerRegistry>
				<scheduler id="Every5Mins">
					<cronTriggerExpression>0 0/5 * * * ? </cronTriggerExpression>
				</scheduler>
			</schedulerRegistry>
		</toolspecific>
		<!--
		***********************************************************************
		Places
		type: start, intermediate, end
		1. Only one end and one start in a net
		***********************************************************************
		-->
		<place id="A">
			<name>
				<text>A</text>
			</name>
			<initialMarking>
				<text>1</text>
			</initialMarking>
			<graphics>
				<position x="28" y="53"/>
				<dimension x="40" y="40"/>
			</graphics>
			<toolspecific tool="Operon" version="1.0">
				<sourcePlace>
					<postCreateCaseAction>com.hoodox.operon.example.CreateCaseAction</postCreateCaseAction>
					<resources>
						<defaultId>packerGroup</defaultId>
					</resources>
				</sourcePlace>
			</toolspecific>
		</place>
		<place id="B">
			<name>
				<text>B</text>
			</name>
			<graphics>
				<position x="133" y="152"/>
				<dimension x="40" y="40"/>
			</graphics>
		</place>
		<place id="C">
			<name>
				<text>C</text>
			</name>
			<graphics>
				<position x="131" y="399"/>
				<dimension x="40" y="40"/>
			</graphics>
		</place>
		<place id="D">
			<name>
				<text>D</text>
			</name>
			<graphics>
				<position x="277" y="54"/>
				<dimension x="40" y="40"/>
			</graphics>
		</place>
		<place id="E">
			<name>
				<text>E</text>
			</name>
			<graphics>
				<position x="435" y="161"/>
				<dimension x="40" y="40"/>
			</graphics>
		</place>
		<place id="F">
			<name>
				<text>F</text>
			</name>
			<graphics>
				<position x="277" y="281"/>
				<dimension x="40" y="40"/>
			</graphics>
		</place>
		<place id="G">
			<name>
				<text>G</text>
			</name>
			<graphics>
				<position x="551" y="55"/>
				<dimension x="40" y="40"/>
			</graphics>
		</place>
		<place id="J">
			<name>
				<text>J</text>
			</name>
			<graphics>
				<position x="672" y="469"/>
				<dimension x="40" y="40"/>
			</graphics>
		</place>
		<place id="K">
			<name>
				<text>K</text>
			</name>
			<graphics>
				<position x="198" y="532"/>
				<dimension x="40" y="40"/>
			</graphics>
			<toolspecific tool="Operon" version="1.0">
				<sinkPlace>true</sinkPlace>
			</toolspecific>
		</place>
		<!--
		***********************************************************************
		Transition
		1. Four possible trigger-types manual, auto, time, message
		    (a) AUTO - this is the default, transition is automatically triggered
		    	   once the transition is in READY state. Transition will FINISH
		    	   when all the actions of the Transition tasks has FINISHED.

		    (b) MANUAL - each status after READY has to be triggered
		         externally, i.e. an external trigger is required to START
		         the transition and an external trigger lto et the Petrinet
		         know that the transition has FINISHED.

		   (c) TIME - An enabled task instance is triggered by a clock,
		         i.e., the task is executed at a predefined time. For example,
		         the task 'remove document' is triggered if a case is trapped
		         in a specific state for more than 15 hours.

		         Once startedTransition will FINISH when
		         all the actions of the Transition tasks has FINISHED.

		   (d) MESSAGE - An external event (i.e. a message) triggers an
		        enabled task instance. Examples of messages are
		        telephone-calls, fax messages, e-mails or EDI messages.
		        Each of these external events will probably require some
		        action within an application task so that the workflow system
		        is made aware that the event has taken place.Once this
		        trggers is pulled the transition will execute and end automatically.
		**********************************************************************
		-->
		<transition id="ChargeCreditCard">
			<name>
				<text>ChargeCreditCard</text>
			</name>
			<graphics>
				<position x="134" y="53"/>
				<dimension x="40" y="40"/>
			</graphics>
			<toolspecific tool="Operon" version="1.0">
				<transitionType type="normal"/>
				<autoTrigger>
					<executionTimeLimit>
						<duration>0-0-10-0</duration>
					</executionTimeLimit>
				</autoTrigger>
				<task>
					<action>com.hoodox.operon.example.wfnet.action.ChargeCreditCardAction</action>
				</task>
			</toolspecific>
		</transition>
		<transition id="Pack">
			<name>
				<text>Pack</text>
			</name>
			<graphics>
				<position x="435" y="55"/>
				<dimension x="40" y="40"/>
			</graphics>
			<toolspecific tool="Operon" version="1.0">
				<transitionType type="XOR_split"/>
				<manualTrigger>
					<resources>
						<defaultId>packerGroup</defaultId>
					</resources>
				</manualTrigger>
				<!-- A Task contains many actions, For manual the actions will only be excuted
				when user choses to FINISH
			-->
				<task>
					<action>com.hoodox.operon.example.wfnet.action.NullAction</action>
				</task>
			</toolspecific>
		</transition>
		<transition id="Ship">
			<name>
				<text>Ship</text>
			</name>
			<graphics>
				<position x="674" y="55"/>
				<dimension x="40" y="40"/>
			</graphics>
			<toolspecific tool="Operon" version="1.0">
				<transitionType type="normal"/>
				<manualTrigger>
					<resources>
						<defaultId>ShipperGroup</defaultId>
					</resources>
				</manualTrigger>
				<task>
					<action>com.hoodox.operon.example.wfnet.action.NullAction</action>
				</task>
			</toolspecific>
		</transition>
		<transition id="SpamCustomer">
			<name>
				<text>SpamCustomer</text>
			</name>
			<graphics>
				<position x="133" y="240"/>
				<dimension x="40" y="40"/>
			</graphics>
			<toolspecific tool="Operon" version="1.0">
				<transitionType type="normal"/>
				<timeTrigger>
					<executionTimeLimit>
						<duration>0-0-10-0</duration>
					</executionTimeLimit>
					<explicitTriggerDelayDuration>
						<duration>4-0-0-0</duration>
					</explicitTriggerDelayDuration>
				</timeTrigger>
				<task>
					<action>com.hoodox.operon.example.wfnet.action.SpamCustomerAction</action>
				</task>
			</toolspecific>
		</transition>
		<transition id="UpdateBillingInfo">
			<name>
				<text>UpdateBillingInfo</text>
			</name>
			<graphics>
				<position x="28" y="469"/>
				<dimension x="40" y="40"/>
			</graphics>
			<toolspecific tool="Operon" version="1.0">
				<transitionType type="XOR_split"/>
				<messageTrigger>
					<resources>
						<defaultId>systemGroup</defaultId>
					</resources>
				</messageTrigger>
				<task>
					<!--For message triggers the actions will only be excuted
				from START to FINISH
			-->
					<action>com.hoodox.operon.example.wfnet.action.UpdateBillingInfoAction</action>
				</task>
			</toolspecific>
		</transition>
		<transition id="CancelOrder">
			<name>
				<text>CancelOrder</text>
			</name>
			<graphics>
				<position x="342" y="401"/>
				<dimension x="40" y="40"/>
			</graphics>
			<toolspecific tool="Operon" version="1.0">
				<transitionType type="normal"/>
				<timeTrigger>
					<executionTimeLimit>
						<duration>0-1-0-0</duration>
					</executionTimeLimit>
					<implicitTriggerDelayDuration>
						<!-- only use when trigger is time,
					add days + hours + mins + seconds -->
						<duration>10-0-0-0</duration>
						<schedulerToUse ref="Every5Mins"/>
					</implicitTriggerDelayDuration>
				</timeTrigger>
				<!-- A Task contains many actions-->
				<task>
					<action>com.hoodox.operon.example.wfnet.action.CancelOrdeAction</action>
				</task>
			</toolspecific>
		</transition>
		<transition id="BackOrder">
			<name>
				<text>BackOrder</text>
			</name>
			<graphics>
				<position x="435" y="283"/>
				<dimension x="40" y="40"/>
			</graphics>
			<toolspecific tool="Operon" version="1.0">
				<transitionType type="normal"/>
				<manualTrigger>
					<resources>
						<defaultId>systemGroup</defaultId>
					</resources>
				</manualTrigger>
				<task>
					<action>com.hoodox.operon.example.wfnet.action.NullAction</action>
				</task>
			</toolspecific>
		</transition>
		<transition id="Receive">
			<name>